{"schema":"actiongate-c01-language-worker-receipt/v1","evidence_kind":"LIVE","repository":"ed3c/ActionGate","issue":20,"language":"typescript","base_sha":"b63589e5a16e82fda1a9554227f2ebbb55398c8a","head_sha":"5865cc3e2d1248cc4429badde720f67311b8fa49","tree_sha":"4897e1b290dc3910c5ed0fc49a8d6cd39193bd63","branch":"ag/C01-typescript-vectors","lease":{"paths":["contracts/impl/typescript/"],"resources":["C01 TypeScript restricted canonicalization candidate"]},"changed_paths":["contracts/impl/typescript/.gitignore","contracts/impl/typescript/CLEAN_ROOM.receipt.json","contracts/impl/typescript/README.md","contracts/impl/typescript/SHADOW_IMPLEMENTATION.receipt.json","contracts/impl/typescript/run.sh","contracts/impl/typescript/src/actionGateCanonical.ts","contracts/impl/typescript/tests/test.ts","contracts/impl/typescript/tsconfig.json","contracts/impl/typescript/RECEIPT.json"],"runtime":{"state":"PASS","commands":[{"argv":["node","--version"],"exit":0},{"argv":["tsc","--version"],"exit":0},{"argv":["bash","contracts/impl/typescript/run.sh"],"exit":0}],"versions":{"node":"22.16.0","typescript":"5.8.3"},"runtime_scope":"OpenAI hosted ephemeral Linux public-source implementation mirror; non-transferable","transferable":false},"contract_digests":{"profile_sha256":"b668ba347b117c2dce2c5fa4f405631c5a776d4c368e295f1cbeeba0ff2dbd83","schema_sha256":"1e4ff81e90eeba6e40fcc26d0b203ef700cfc5b9c38b9bb4f7b39c9bb9940221","vectors_sha256":"e934d0755979f5281fdf11b760e683a01bf8b935f45a300ccdafc299c9d46cf9"},"positive_results":[{"id":"arguments_hash","state":"PASS","expected":"aDAZpSSDV7-lNqYY5ViQqqUTcU8J6m-qPpFu4QjfTUk","actual":"aDAZpSSDV7-lNqYY5ViQqqUTcU8J6m-qPpFu4QjfTUk","reason":"domain-separated restricted canonical arguments matched"},{"id":"action_digest","state":"PASS","expected":"XD8ngJ-f1tD-cwVWTuqFWCCPuwTjAVyzV63rtNgW89c","actual":"XD8ngJ-f1tD-cwVWTuqFWCCPuwTjAVyzV63rtNgW89c","reason":"domain-separated ActionEnvelope digest matched"},{"id":"authorization_signing_input_sha256","state":"PASS","expected":"8sC8JA9BcBFHT9swpU81Y5EuI3bvTxzxQKYVIWTFdkw","actual":"8sC8JA9BcBFHT9swpU81Y5EuI3bvTxzxQKYVIWTFdkw","reason":"authorization signing input SHA-256 matched"}],"negative_results":[{"id":"ordering","state":"PASS","expected":"insertion-order-independent","actual":"explicit-sorted-key-output","reason":"permuted object insertion produced identical canonical bytes"},{"id":"float_rejected","state":"PASS","expected":"REJECT","actual":"REJECT","reason":"floating point is outside the restricted profile"},{"id":"unsafe_integer_rejected","state":"PASS","expected":"REJECT","actual":"REJECT","reason":"integer outside ±(2^53-1) rejected"},{"id":"invalid_key_rejected","state":"PASS","expected":"REJECT","actual":"REJECT","reason":"dynamic key outside the ASCII-key profile rejected"},{"id":"unsupported_value_rejected","state":"PASS","expected":"REJECT","actual":"REJECT","reason":"binary/runtime-specific value rejected"},{"id":"duplicate_key_control","state":"PASS","expected":"REJECT","actual":"REJECT","reason":"raw duplicate object member rejected before canonicalization"},{"id":"unicode_no_normalization","state":"PASS","expected":"distinct composed/decomposed bytes","actual":"distinct composed/decomposed bytes","reason":"Unicode values were preserved without normalization"}],"denominator":{"required":10,"pass":10,"fail":0,"not_exercised":0,"not_representable":0},"dependencies":[{"name":"Node and TypeScript compiler built-ins","version":"Node 22.16.0 / TypeScript 5.8.3","license_state":"toolchain/runtime only; no vendored dependency"}],"rights_state":"BUILTINS_ONLY_NO_VENDORED_THIRD_PARTY","clean_room_state":"CLEAN_ROOM_PRECHECK_PASS","shadow":{"observer_kind":"SAME_CONTEXT_READ_ONLY_SHADOW","independence_claimed":false,"deltas":["explicit key sorting replaces object insertion order","Number.isSafeInteger and the profile range reject floats and unsafe integers","raw duplicate-key parsing runs before JSON.parse can erase duplicate provenance","lone surrogates are rejected and UTF-8 output is not normalized"],"dissent":["This receipt is stored in a successor evidence commit; head_sha and tree_sha bind the implementation candidate immediately before the receipt commit.","Independent Shadow Issue #26 remains NOT_EXERCISED.","C01 convergence Issue #24 remains separate.","Hardware, MCP, security/legal acceptance, merge and release are not proven."]},"evidence_lane":"local-deterministic canonicalization only","evidence_state":"PASS","blockers":[],"rollback":"b63589e5a16e82fda1a9554227f2ebbb55398c8a","human_owned":["independent Shadow admission","semantic conflict resolution","security/legal acceptance","merge","release","production"]}
